{
  "schema_version": "kernel-tcb-roots/v1",
  "classification_path": "tests/fixtures/tk00/tcb/classification.json",
  "runtime_roots": [
    { "id": "static-entry", "path": "tests/fixtures/tk00/tcb/static-entry.ps1", "role": "Static Join-Path import.", "layer": "k1-runtime-kernel", "reason": "Tests AST closure." }
  ],
  "distribution_roots": [
    { "id": "fixture-leaf", "path": "tests/fixtures/tk00/tcb/leaf.psm1", "role": "Shared fixture leaf.", "layer": "k0-trust-primitive", "reason": "Tests multi-path reachability." }
  ],
  "trust_artifacts": [],
  "manual_edges": [],
  "external_dependencies": [],
  "budget": { "baseline_executable_loc": 0, "exceptions": [] }
}
