{
  "schema_version": "kernel-tcb-roots/v1",
  "classification_path": "tests/fixtures/tk00/tcb/classification.json",
  "runtime_roots": [
    { "id": "dynamic-entry", "path": "tests/fixtures/tk00/tcb/dynamic-import.ps1", "role": "Unreviewed dynamic import.", "layer": "k1-runtime-kernel", "reason": "Must fail closed." }
  ],
  "distribution_roots": [
    { "id": "fixture-leaf", "path": "tests/fixtures/tk00/tcb/leaf.psm1", "role": "Fixture leaf.", "layer": "k0-trust-primitive", "reason": "Schema-required second trust path." }
  ],
  "trust_artifacts": [],
  "manual_edges": [],
  "external_dependencies": [],
  "budget": { "baseline_executable_loc": 0, "exceptions": [] }
}
